{
  "contract_version": "1",
  "type": "transcript_reconciled",
  "event_id": "00000000-0000-4000-8000-000000000007",
  "meeting_id": "aaaaaaaa-aaaa-4aaa-8aaa-aaaaaaaaaaaa",
  "occurred_at": "2026-08-21T10:03:00Z",
  "payload": {
    "transcript_revision": 4,
    "content_revision": 4,
    "replace_from_ms": 1000,
    "segments": [
      {
        "id": "11111111-1111-4111-8111-111111111111",
        "order": 0,
        "speaker_key": "speechrail:spk-e2e-1:speaker-source:s1:spk_01",
        "speaker_name": "说话人 1",
        "start_ms": 1000,
        "end_ms": 2000,
        "text": "确认发布。",
        "translation": null,
        "detected_language": "zh",
        "source_epoch": 1,
        "speaker_status": "stable",
        "timing_quality": "aligned",
        "overlap_ratio": 0.0,
        "speaker_manual": false
      },
      {
        "id": "11111111-1111-4111-8111-111111111112",
        "order": 1,
        "speaker_key": "unknown",
        "speaker_name": "未知说话人",
        "start_ms": 2100,
        "end_ms": 2600,
        "text": "同意。",
        "translation": null,
        "detected_language": "zh",
        "source_epoch": 1,
        "speaker_status": "tentative",
        "timing_quality": "aligned",
        "overlap_ratio": 0.12,
        "speaker_manual": false
      }
    ]
  }
}
